data_id,question,answer,tokens,token_count
553,昨年放送されたドラマ『Wの悲劇』『息もできない夏』『東京全力少女』で主演を務めた女優は誰でしょう？,武井咲(たけい・えみ),|昨年放送|さ|れ|た|ドラマ|『Wの悲劇』|『|息|も|でき|ない|夏|』|『東京全力少女』|で|主演|を|務め|た|女優|は|誰|でしょう|？|,24
554,1950年に天台宗から独立して聖観音宗(しょうかんのんしゅう)の総本山となった、毎年7月にほおずき市が開かれる寺院はどこでしょう？,浅草寺(せんそうじ),|1950|年|に|天台|宗|から|独立|し|て|聖|観音|宗|の|総|本山|と|なっ|た|、|毎年|7|月|に|ほおずき市|が|開か|れる|寺院|は|どこ|でしょう|？|,32
555,子供がよく間違って書いてしまう、上下は正しいのに左右が逆になった字のことを、俗に何文字というでしょう？,鏡文字,|子供|が|よく|間違っ|て|書い|て|しまう|、|上下|は|正しい|の|に|左右|が|逆|に|なっ|た|字|の|こと|を|、|俗|に|何|文字|と|いう|でしょう|？|,33
556,望んでいた通りに事が運ぶことを「願ったり叶ったり」といいますが、災難が続き散々な目にあうことを、2つの動詞を用いて何というでしょう？,踏んだり蹴ったり,|望ん|で|い|た|通り|に|事|が|運ぶ|こと|を|「|願っ|たり|叶っ|たり|」|と|いい|ます|が|、|災難|が|続き|散々|な|目|に|あう|こと|を|、|2|つ|の|動詞|を|用い|て|何|と|いう|でしょう|？|,45
557,オーケストラの指揮者や作曲家に対する敬称として使われる、イタリア語で「巨匠」を意味する言葉は何でしょう？,マエストロ,|オーケストラ|の|指揮|者|や|作曲|家|に|対する|敬称|と|し|て|使わ|れる|、|イタリア|語|で|「巨匠」|を|意味|する|言葉|は|何|でしょう|？|,28
558,記号Svで表記される、人が放射線を浴びた時の、人体への影響の度合いを表すSI単位は何でしょう？,シーベルト,|記号|Sv|で|表記|さ|れる|、|人|が|放射|線|を|浴び|た|時|の|、|人体|へ|の|影響|の|度合い|を|表す|SI|単位|は|何|でしょう|？|,31
559,第1回メフィスト賞を『すべてがFになる』で受賞した、『スカイ・クロラ』シリーズなどで知られる作家は誰でしょう？,森博嗣(もり・ひろし),|第|1|回|メフィスト|賞|を|『|すべて|が|F|に|なる|』|で|受賞|し|た|、|『|スカイ|・|クロラ|』|シリーズ|など|で|知ら|れる|作家|は|誰|でしょう|？|,33
560,走り高跳びの跳び方で、お腹を下に向けてバーを巻き込むようにして跳び越すものを何というでしょう？,ベリーロール,|走り|高跳び|の|跳び|方|で|、|お腹|を|下|に|向け|て|バー|を|巻き込む|よう|に|し|て|跳び越す|もの|を|何|と|いう|でしょう|？|,28
561,タリム河の流れによって位置を変えたことから「さまよえる湖」と呼ばれた湖は何でしょう？,ロプノール湖(LobNor),|タリム|河|の|流れ|に|よっ|て|位置|を|変え|た|こと|から|「さまよえる湖」|と|呼ば|れ|た|湖|は|何|でしょう|？|,23
562,『ヘイ・ジョー』や『パープル・ヘイズ』などの代表曲があるアメリカのロックギタリストで、「ジミヘン」の愛称で知られるのは誰でしょう？,ジミ・ヘンドリックス(Jimi Hendrix),|『ヘイ・ジョー』|や|『|パープル|・|ヘイズ|』|など|の|代表曲|が|ある|アメリカ|の|ロックギタリスト|で|、|「ジミヘン」|の|愛称|で|知ら|れる|の|は|誰|でしょう|？|,28
563,ギリシア語で「場所が不特定」、転じて「奇妙な病気」という意味がある、皮膚炎を伴うアレルギー性の過敏症を何というでしょう？,アトピー,|ギリシア|語|で|「場所が不特定」|、|転じ|て|「奇妙な病気」|と|いう|意味|が|ある|、|皮膚|炎|を|伴う|アレルギー|性|の|過敏|症|を|何|と|いう|でしょう|？|,29
564,漢字の部首の「かんむり」を漢字で書いたとき、その部首は何になるでしょう？,わかんむり,|漢字|の|部首|の|「かんむり」|を|漢字|で|書い|た|とき|、|その|部首|は|何|に|なる|でしょう|？|,20
565,原油や物質の運搬に使われるためその防衛が議論となる、国が重要と定める海上交通路の事を英語で何というでしょう？,シーレーン,|原油|や|物質|の|運搬|に|使わ|れる|ため|その|防衛|が|議論|と|なる|、|国|が|重要|と|定める|海上交通|路|の|事|を|英語|で|何|と|いう|でしょう|？|,33
566,『大いなる遺産』『二都物語』などの作品で知られる、19世紀に活躍したイギリスの作家は誰でしょう？,チャールズ・ディケンズ(Charles John Huffam Dickens),|『大いなる遺産』|『二都物語』|など|の|作品|で|知ら|れる|、|19|世紀|に|活躍|し|た|イギリス|の|作家|は|誰|でしょう|？|,22
567,2002年には創部1年目のサッカー部が、2012年には野球部が春の甲子園に出場した、長野県にある通信制高校はどこでしょう？,地球環境高校,|2002|年|に|は|創部|1|年|目|の|サッカー|部|が|、|2012|年|に|は|野球部|が|春|の|甲子|園|に|出場|し|た|、|長野県|に|ある|通信|制|高校|は|どこ|でしょう|？|,38
568,シチリア島、サルデーニャ島に次いでイタリアで3番目の面積をもつ島で、フランス領時代の1814年にナポレオンが流されたのはどこでしょう？,エルバ島(Isola d'Elba),|シチリア|島|、|サルデーニャ|島|に|次い|で|イタリア|で|3|番|目|の|面積|を|もつ|島|で|、|フランス|領|時代|の|1814|年|に|ナポレオン|が|流さ|れ|た|の|は|どこ|でしょう|？|,37
569,ブラジルのサンタマリア鉱山で発掘されるものが最高級品種である、3月の誕生石のひとつである青色の宝石は何でしょう？,アクアマリン(aquamarine),|ブラジル|の|サンタマリア|鉱山|で|発掘|さ|れる|もの|が|最|高級品種|で|ある|、|3|月|の|誕生|石|の|ひと|つ|で|ある|青色|の|宝石|は|何|でしょう|？|,32
570,1984年にカナダのギー・ラリベルテが創始した、フランス語で「太陽のサーカス」という意味の名を持つエンターテインメント集団は何でしょう？,シルク・ドゥ・ソレイユ(Cirque du Soleil),|1984|年|に|カナダ|の|ギー|・|ラリベルテ|が|創始|し|た|、|フランス|語|で|「|太陽|の|サーカス|」|と|いう|意味|の|名|を|持つ|エンターテインメント|集団|は|何|でしょう|？|,34
571,中国古代・殷の時代に行われた、亀の甲羅を焼き、その裂け目を見て行う占いの一種は何でしょう？,亀卜(きぼく),|中国古代|・|殷|の|時代|に|行わ|れ|た|、|亀|の|甲羅|を|焼き|、|その|裂け目|を|見|て|行う|占い|の|一種|は|何|でしょう|？|,29
572,イタリア語で「敬虔な心」「慈悲の心」という意味がある、わが子イエスの死を嘆くマリアの姿を主題とした絵画の形式は何でしょう？,ピエタ(Pietà),|イタリア|語|で|「敬虔な心」|「慈悲の心」|と|いう|意味|が|ある|、|わが|子|イエス|の|死|を|嘆く|マリア|の|姿|を|主題|と|し|た|絵画|の|形式|は|何|でしょう|？|,33
573,「天叢雲剣」の別名もある、日本神話でスサノオノミコトがヤマタノオロチを退治した後に尾から出たとされる三種の神器の一つは何でしょう？,草薙剣(くさなぎのつるぎ、くさなぎのけん、くさなぎのたち),|「天叢雲剣」|の|別名|も|ある|、|日本神話|で|スサノオ|ノ|ミコト|が|ヤマタ|ノ|オロチ|を|退治|し|た|後|に|尾|から|出|た|と|さ|れる|三種|の|神器|の|一|つ|は|何|でしょう|？|,38
574,「ICカード」や「ICチップ」などという時の「IC」とは何という英語の略でしょう？,Integrated Circuit,|「ICカード」|や|「ICチップ」|など|と|いう|時|の|「IC」|と|は|何|と|いう|英語|の|略|でしょう|？|,19
575,オーバルと呼ばれる競技場に2本のウィケットを置いて行う、イギリス発祥の球技は何でしょう？,クリケット,|オーバル|と|呼ば|れる|競技|場|に|2|本|の|ウィケット|を|置い|て|行う|、|イギリス|発祥|の|球技|は|何|でしょう|？|,24
576,代表作に『友達のうちはどこ?』や、1997年のカンヌ映画祭でグランプリを受賞した『桜桃(おうとう)の味』などがある、イランの映画監督は誰でしょう？,アッバス・キアロスタミ,|代表|作|に|『|友達|の|うち|は|どこ|?|』|や|、|1997|年|の|カンヌ|映画|祭|で|グランプリ|を|受賞|し|た|『桜桃の味』|など|が|ある|、|イラン|の|映画監督|は|誰|でしょう|？|,37
577,国会議員のバッジ、パスポートの表紙、50円硬貨に共通して描かれている花は何でしょう？,菊,|国会議員|の|バッジ|、|パスポート|の|表紙|、|50|円硬貨|に|共通|し|て|描か|れ|て|いる|花|は|何|でしょう|？|,23
578,タクシーで、客が乗っていない状態を空車というのに対し、客が乗っている状態のことを何というでしょう？,実車(じっしゃ),|タクシー|で|、|客|が|乗っ|て|い|ない|状態|を|空車|と|いう|の|に|対し|、|客|が|乗っ|て|いる|状態|の|こと|を|何|と|いう|でしょう|？|,32
579,元々は「建築様式」を意味する、コンピュータ関連で基本設計や設計思想を指す用語は何でしょう？,アーキテクチャ,|元々|は|「建築様式」|を|意味|する|、|コンピュータ|関連|で|基本設計|や|設計思想|を|指す|用語|は|何|でしょう|？|,20
580,水の「硬度」の基準となる2つの金属イオンとは何と何でしょう？,カルシウムとマグネシウム,|水|の|「硬度」|の|基準|と|なる|2|つ|の|金属|イオン|と|は|何|と|何|でしょう|？|,19
581,ケーキやアイスクリームのトッピングに使われる銀色の小さな粒を何というでしょう？,アラザン,|ケーキ|や|アイス|クリーム|の|トッピング|に|使わ|れる|銀色|の|小さな|粒|を|何|と|いう|でしょう|？|,19
582,「東」「西」「南」「北」を漢字で書いたとき最も画数が多いのはどれでしょう？,南,|「東」|「西」|「南」|「北」|を|漢字|で|書い|た|とき|最も|画数|が|多い|の|は|どれ|でしょう|？|,19
583,昨年6月に亡くなった、代表作に『火星年代記』『華氏451度』があるアメリカのSF作家は誰でしょう？,レイ・ブラッドベリ(Ray Bradbury),|昨年|6|月|に|亡くなっ|た|、|代表|作|に|『火星年代記』|『華氏451度』|が|ある|アメリカ|の|SF|作家|は|誰|でしょう|？|,22
584,昨年、その背番号24が埼玉西武ライオンズの永久欠番となった、西鉄ライオンズで活躍した往年の名投手は誰でしょう？,稲尾和久(いなお・かずひさ),|昨年|、|その|背番号|24|が|埼玉西武|ライオンズ|の|永久欠番|と|なっ|た|、|西鉄|ライオンズ|で|活躍|し|た|往年|の|名|投手|は|誰|でしょう|？|,28
585,昨年には続編となる「college(カレッジ)」と「highschool(ハイスクール)」も刊行された、かきふらい原作の漫画は何でしょう？,『けいおん!』,|昨年|に|は|続編|と|なる|「|college|」|と|「|highschool|」|も|刊行|さ|れ|た|、|かき|ふらい|原作|の|漫画|は|何|でしょう|？|,28
586,スケートリンクと特大のクリスマスツリーが、ニューヨークの冬の風物詩となっている、石油王の名が冠せられた複合施設は何でしょう？,ロックフェラー・センター(Rockefeller Center),|スケート|リンク|と|特大|の|クリスマス|ツリー|が|、|ニューヨーク|の|冬|の|風物詩|と|なっ|て|いる|、|石油王|の|名|が|冠せ|られ|た|複合施設|は|何|でしょう|？|,31
587,江戸時代、両替屋に払った手数料のことを「何賃」といったでしょう？,切賃(きりちん)※「打賃」「打銭」も○。,|江戸時代|、|両替|屋|に|払っ|た|手数|料|の|こと|を|「何賃」|と|いっ|た|でしょう|？|,18
588,一般的に、標高が高くなると水の沸点は、上がる・下がるのどちらでしょう？,下がる,|一般|的|に|、|標高|が|高く|なる|と|水|の|沸点|は|、|上がる|・|下がる|の|どちら|でしょう|？|,21
589,EU・欧州連合の創設を定めた条約のことを、制定されたオランダの都市の名前をとって何というでしょう？,マーストリヒト条約,|EU|・|欧州連合|の|創設|を|定め|た|条約|の|こと|を|、|制定|さ|れ|た|オランダ|の|都市|の|名前|を|とっ|て|何|と|いう|でしょう|？|,30
590,「序曲と獅子王の行進曲」から「終曲」までの全14曲からなる、フランスの作曲家サン=サーンスが作った組曲は何でしょう？,『動物の謝肉祭』,|「|序曲|と|獅子|王|の|行進|曲|」|から|「終曲」|まで|の|全|14|曲|から|なる|、|フランス|の|作曲|家|サン|=|サーンス|が|作っ|た|組曲|は|何|でしょう|？|,34
591,暑さを和らげるために道や庭先に水を撒くことを何というでしょう？,打ち水,|暑|さ|を|和らげる|ため|に|道|や|庭先|に|水|を|撒く|こと|を|何|と|いう|でしょう|？|,20
592,新しい辞書『大渡海(だいとかい)』の編纂を行う日々とを描いた、昨年(2012年)の本屋大賞を受賞した三浦しをんの小説は何でしょう？,『舟を編む』,|新しい|辞書|『大渡海』|の|編纂|を|行う|日々|と|を|描い|た|、|昨年(2012年)|の|本屋大賞|を|受賞|し|た|三浦|しをん|の|小説|は|何|でしょう|？|,28
593,『「激安」のからくり』『「値切り」のマジック』などの著書で知られる、昨年(2012年)10月に肺カルチノイドのため亡くなった流通ジャーナリストは誰でしょう？,金子哲雄(かねこ・てつお),|『|「|激安|」|の|からくり|』|『|「|値切り|」|の|マジック|』|など|の|著書|で|知ら|れる|、|昨年(2012年)|10|月|に|肺|カルチノイド|の|ため|亡くなっ|た|流通|ジャーナリスト|は|誰|でしょう|？|,37
594,子育て雑誌の「たまごクラブ」「ひよこクラブ」を発行している日本の出版社はどこでしょう？,ベネッセコーポレーション,|子育て|雑誌|の|「たまごクラブ」|「ひよこクラブ」|を|発行|し|て|いる|日本|の|出版社|は|どこ|でしょう|？|,17
595,「鶏口(けいこう)となるも牛後(ぎゅうご)となるなかれ」と同じ意味のことわざを、魚に例えて「鯛の尾よりも何の頭」と言うでしょう？,鰯(いわし),|「|鶏口|と|なる|も|牛後|と|なる|なかれ|」|と|同じ|意味|の|ことわざ|を|、|魚|に|例え|て|「|鯛|の|尾|より|も|何|の|頭|」|と|言う|でしょう|？|,35
596,映画監督・黒澤明の監督デビュー作は『姿三四郎』ですが、遺作となった映画は何でしょう？,『まあだだよ』,|映画監督|・|黒澤明|の|監督|デビュー|作|は|『姿三四郎』|です|が|、|遺作|と|なっ|た|映画|は|何|でしょう|？|,21
597,独立行政法人国立文化財機構が管轄している4つの国立博物館とは、東京国立博物館、京都国立博物館、奈良国立博物館とどこでしょう？,九州国立博物館,|独立行政法人国立文化|財|機構|が|管轄|し|て|いる|4|つ|の|国立博物|館|と|は|、|東京国立博物|館|、|京都国立博物|館|、|奈良国立博物|館|と|どこ|でしょう|？|,28
598,ラグビーのニュージーランド代表が試合前に行う、先住民の戦いの儀式は何でしょう？,ハカ,|ラグビー|の|ニュージーランド|代表|が|試合前|に|行う|、|先住|民|の|戦い|の|儀式|は|何|でしょう|？|,19
599,AKB48の『ヘビーローテーション』等のヒット曲の振り付けでも知られる、1987年にリリースした『Love Song探して』で知られる歌手は誰でしょう？,牧野アンナ,|AKB|48|の|『|ヘビー|ローテーション|』|等|の|ヒット|曲|の|振り付け|で|も|知ら|れる|、|1987|年|に|リリース|し|た|『|LoveSong|探し|て|』|で|知ら|れる|歌手|は|誰|でしょう|？|,37
600,盛唐の詩人・李白の詩『答王十二寒夜独酌有怀』(おうじゅうにのかんやどくしゃくおもいあるにこたう)を出典とする、人の言葉を少しも心に留めずに聞き流すことを意味する四字熟語は何でしょう？,馬耳東風(ばじとうふう),|盛唐|の|詩人|・|李白|の|詩|『|答|王|十|二|寒夜|独酌|有|怀|』(おうじゅうにのかんやどくしゃくおもいあるにこたう)|を|出典|と|する|、|人|の|言葉|を|少し|も|心|に|留め|ず|に|聞き流す|こと|を|意味|する|四字熟語|は|何|でしょう|？|,43
601,日本の銀行で、南日本銀行の本店があるのは鹿児島県ですが、北日本銀行の本店があるのはどこの都道府県でしょう？,岩手県,|日本|の|銀行|で|、|南日本銀行|の|本店|が|ある|の|は|鹿児島県|です|が|、|北日本銀行|の|本店|が|ある|の|は|どこ|の|都道府県|でしょう|？|,28
602,人形浄瑠璃の三人遣いのうち、首や右腕を動かすのは何でしょう？,主遣い(おもづかい),|人形浄瑠璃|の|三|人|遣い|の|うち|、|首|や|右腕|を|動かす|の|は|何|でしょう|？|,18
603,1970年にオフコースのボーカルとしてデビューした、『さよなら』『ラブストーリーは突然に』『言葉にできない』などの代表曲がある歌手は誰でしょう？,小田和正(おだ・かずまさ),|1970|年|に|オフ|コース|の|ボーカル|と|し|て|デビュー|し|た|、|『さよなら』|『|ラブ|ストーリー|は|突然|に|』|『|言葉|に|でき|ない|』|など|の|代表曲|が|ある|歌手|は|誰|でしょう|？|,38
604,将棋の飛車と同じ動きをする、城をかたどったチェスの駒は何でしょう？,ルーク,|将棋|の|飛車|と|同じ|動き|を|する|、|城|を|かたどっ|た|チェス|の|駒|は|何|でしょう|？|,20
605,本名をゲオルグ・バウエルというドイツの冶金学者で、鉱山や鉱物について書かれた著書『デ・レ・メタリカ』で知られるのは誰でしょう？,ゲオルグ・アグリコラ,|本名|を|ゲオルグ|・|バウエル|と|いう|ドイツ|の|冶金|学|者|で|、|鉱山|や|鉱物|に|つい|て|書か|れ|た|著書|『|デ|・|レ|・|メタリカ|』|で|知ら|れる|の|は|誰|でしょう|？|,39
606,映画では森繁久彌と淡島千景の名演が人気を博した、大阪の法善寺横丁を舞台にした織田作之助の小説は何でしょう？,『夫婦善哉』(めおとぜんざい),|映画|で|は|森繁久彌|と|淡島千景|の|名演|が|人気|を|博し|た|、|大阪|の|法善|寺|横丁|を|舞台|に|し|た|織田作之助|の|小説|は|何|でしょう|？|,31
607,昨年、ドーピング問題によってツール・ド・フランス7連覇などの記録が抹消された、アメリカの元自転車ロードレース選手は誰でしょう？,ランス・アームストロング(Lance EdwardArmstrong),|昨年|、|ドーピング|問題|に|よっ|て|ツール|・|ド|・|フランス|7|連覇|など|の|記録|が|抹消|さ|れ|た|、|アメリカ|の|元自転|車|ロード|レース|選手|は|誰|でしょう|？|,34
608,東京都にある大森貝塚を発見した、アメリカ出身の動物学者は誰でしょう？,エドワード・モース(Edward Sylvester Morse),|東京都|に|ある|大森貝塚|を|発見|し|た|、|アメリカ|出身|の|動物|学|者|は|誰|でしょう|？|,19
609,日本の市町村で、湖南(こなん)市があるのは滋賀県ですが、湖西(こさい)市がある都道府県はどこでしょう？,静岡県,|日本|の|市町村|で|、|湖南市|が|ある|の|は|滋賀県|です|が|、|湖西市|が|ある|都道府県|は|どこ|でしょう|？|,22
610,トルストイの小説『復活』で、カチューシャを救うために奔走する主人公の名前は何でしょう？,ネフリュードフ(Нехлюдов),|トルストイ|の|小説|『復活』|で|、|カチューシャ|を|救う|ため|に|奔走|する|主人|公|の|名前|は|何|でしょう|？|,21
611,ル・アーブルの港から昇る太陽が描かれている、「印象派」という言葉の由来となったクロード・モネの絵画は何でしょう？,"『印象・日の出』(Impression,Sunrise)",|ル・アーブル|の|港|から|昇る|太陽|が|描か|れ|て|いる|、|「印象派」|と|いう|言葉|の|由来|と|なっ|た|クロード|・|モネ|の|絵画|は|何|でしょう|？|,30
612,新しく仏像を作った際に、魂を込めるために眼を描きいれることを何というでしょう？,開眼(かいげん),|新しく|仏像|を|作っ|た|際|に|、|魂|を|込める|ため|に|眼|を|描き|いれる|こと|を|何|と|いう|でしょう|？|,24
613,「演歌一筋40年」を自称し、昨年5月には『人生かぞえ唄』でCDデビューも果たした、お笑い芸人・友近が扮する演歌歌手は誰でしょう？,水谷千恵子(みずたに・ちえこ),|「|演歌|一筋|40|年|」|を|自称|し|、|昨年|5|月|に|は|『人生かぞえ唄』|で|CD|デビュー|も|果たし|た|、|お|笑い|芸人|・|友近|が|扮する|演歌歌手|は|誰|でしょう|？|,35
614,コーラとしてははじめての特定保健用食品に指定されヒット商品となっている、キリンの清涼飲料水は何でしょう？,メッツコーラ,|コーラ|と|し|て|は|はじめて|の|特定保健|用|食品|に|指定|さ|れ|ヒット|商品|と|なっ|て|いる|、|キリン|の|清涼飲料|水|は|何|でしょう|？|,29
615,日南海岸国定公園の一部となっている、御崎馬(みさきうま)という野生の馬が棲息することで知られる宮崎県南部の岬はどこでしょう？,都井岬(といみさき),|日南海岸国定公園|の|一部|と|なっ|て|いる|、|御崎馬|と|いう|野生|の|馬|が|棲息|する|こと|で|知ら|れる|宮崎県南部|の|岬|は|どこ|でしょう|？|,28
616,「Self Contained Underwater Breathing Apparatus」の略である、水中で呼吸をするための装置のことを何というでしょう？,スキューバ(SCUBA),|「|S|e|l|f|C|o|n|t|a|i|n|e|d|U|n|d|erwaterBreathingApparatus|」|の|略|で|ある|、|水中|で|呼吸|を|する|ため|の|装置|の|こと|を|何|と|いう|でしょう|？|,40
617,琴の名曲のひとつ「六段の調」を作曲した、近世箏曲の祖とも呼ばれる江戸時代の箏曲家は誰でしょう？,八橋検校(やつはし・けんぎょう),|琴|の|名曲|の|ひと|つ|「六段の調」|を|作曲|し|た|、|近世箏曲|の|祖|と|も|呼ば|れる|江戸時代|の|箏曲|家|は|誰|でしょう|？|,27
618,チャールズ・リンドバーグが、大西洋単独無着陸飛行に成功したときに乗っていたプロペラ機に付けた愛称は何でしょう？,スピリット・オブ・セントルイス(Spirit of St.Louis),|チャールズ|・|リンドバーグ|が|、|大西|洋|単独|無|着陸飛行|に|成功|し|た|とき|に|乗っ|て|い|た|プロペラ|機|に|付け|た|愛称|は|何|でしょう|？|,30
619,正式には「流行性角結膜炎」という、目の病気の通称は何でしょう？,はやり目,|正式|に|は|「|流行|性|角|結膜|炎|」|と|いう|、|目|の|病気|の|通称|は|何|でしょう|？|,22
620,秋保(あきう)温泉、作並温泉、鳴子温泉といったらどこの都道府県の温泉でしょう？,宮城県,|秋保温泉|、|作並温泉|、|鳴子温泉|と|いっ|たら|どこ|の|都道府県|の|温泉|でしょう|？|,15
621,「絶対的な信頼」という意味の英語から創業者の小池聰行(こいけそうこう)が名付けた、ヒットチャート等の音楽情報を提供する企業グループは何でしょう？,オリコン株式会社,|「絶対的な信頼」|と|いう|意味|の|英語|から|創業|者|の|小池聰|行|が|名付け|た|、|ヒット|チャート|等|の|音楽情報|を|提供|する|企業|グループ|は|何|でしょう|？|,30
622,流れをくむ鳥羽高校も2012年の春の甲子園に出場している、1915年に行われた第1回全国中等学校優勝野球大会を制した学校はどこでしょう？,京都二中(京都府第二中学校),|流れ|を|くむ|鳥羽高校|も|2012|年|の|春|の|甲子|園|に|出場|し|て|いる|、|1915|年|に|行わ|れ|た|第|1|回全国中等学校優勝野球大会|を|制し|た|学校|は|どこ|でしょう|？|,35
