data_id,question,answer,tokens,token_count
1182,代表作に『遠き落日』『失楽園』『愛の流刑地』がある日本の作家は誰でしょう？,渡辺淳一(わたなべ・じゅんいち),|代表|作|に|『遠き落日』|『失楽園』|『愛の流刑地』|が|ある|日本|の|作家|は|誰|でしょう|？|,15
1183,若者に人気のバスケットボールと、老人に人気のゲートボールに共通する1チームの人数は何人でしょう？,5人,|若者|に|人気|の|バスケットボール|と|、|老人|に|人気|の|ゲート|ボール|に|共通|する|1|チーム|の|人数|は|何|人|でしょう|？|,25
1184,お笑いコンビ、雨上がり決死隊の2人とは、宮迫博之と誰でしょう？,蛍原徹(ほとはら・とおる),|お|笑い|コンビ|、|雨上がり|決死|隊|の|2|人|と|は|、|宮迫博之|と|誰|でしょう|？|,18
1185,ヴィッテル、コントレックス、エビアンは、いずれもどこの国が原産のミネラルウォーターでしょう？,フランス,|ヴィッテル|、|コントレックス|、|エビアン|は|、|いずれ|も|どこ|の|国|が|原産|の|ミネラル|ウォーター|でしょう|？|,19
1186,竹中半兵衛と共に豊臣秀吉の双璧とうたわれた人物で、「ドン・シメオン」という洗礼名のある戦国武将は誰でしょう？,黒田官兵衛(くろだ・かんべえ),|竹中半兵衛|と|共|に|豊臣秀吉|の|双璧|と|うたわ|れ|た|人物|で|、|「|ドン|・|シメオン|」|と|いう|洗礼名|の|ある|戦国武将|は|誰|でしょう|？|,29
1187,ゴーギャンをモデルに小説『月と六ペンス』を書いた、イギリスの作家は誰でしょう？,ウィリアム・サマセット・モーム(William Somerset Maugham),|ゴーギャン|を|モデル|に|小説|『月と六ペンス』|を|書い|た|、|イギリス|の|作家|は|誰|でしょう|？|,17
1188,大地震や台風などの災害時に使われる「災害用伝言ダイヤル」の番号は何番でしょう？,171番,|大|地震|や|台風|など|の|災害時|に|使わ|れる|「|災害|用|伝言|ダイヤル|」|の|番号|は|何番|でしょう|？|,22
1189,ロゴマークには槍を高くかざした原始人が描かれている、角川書店の編集者だった見城徹(けんじょう・とおる)らが設立した出版社は何でしょう？,幻冬舎(げんとうしゃ),|ロゴ|マーク|に|は|槍|を|高く|かざし|た|原始|人|が|描か|れ|て|いる|、|角川書店|の|編集|者|だっ|た|見城徹|ら|が|設立|し|た|出版社|は|何|でしょう|？|,34
1190,代表という意味の「セレソン」、チームカラーからつけられた「カナリヤ軍団」といった別名で呼ばれるのは、どこの国のサッカーのナショナルチームでしょう？,ブラジル,|代表|と|いう|意味|の|「セレソン」|、|チーム|カラー|から|つけ|られ|た|「カナリヤ軍団」|と|いっ|た|別名|で|呼ば|れる|の|は|、|どこ|の|国|の|サッカー|の|ナショナル|チーム|でしょう|？|,34
1191,台風の進行方向の左側と右側のうち、比較的風雨が強い「危険半円」に該当するのはどちらでしょう？,右側,|台風|の|進行方向|の|左側|と|右側|の|うち|、|比較|的|風雨|が|強い|「危険半円」|に|該当|する|の|は|どちら|でしょう|？|,24
1192,原作では「スヌス・ムムリク」という名前だった、アニメ『ムーミン』に登場する放浪の旅人といえば誰でしょう？,スナフキン,|原作|で|は|「|スヌス・ムムリク|」|と|いう|名前|だっ|た|、|アニメ|『ムーミン』|に|登場|する|放浪|の|旅人|と|いえ|ば|誰|でしょう|？|,26
1193,女性ヴォーカルのロックバンドとして、はじめて100万枚のアルバムセールスを記録した、『MOON』や『フレンズ』などのヒット曲で知られるバンドは何でしょう？,レベッカ(REBECCA),|女性|ヴォーカル|の|ロックバンド|と|し|て|、|はじめて|100|万|枚|の|アルバム|セールス|を|記録|し|た|、|『MOON』|や|『フレンズ』|など|の|ヒット|曲|で|知ら|れる|バンド|は|何|でしょう|？|,35
1194,妹の梨良(りら)も同じく卓球選手である、ロンドンオリンピックの卓球女子団体で銀メダル獲得に貢献した選手は誰でしょう？,石川佳純(いしかわ・かすみ),|妹|の|梨良|も|同じく|卓球選手|で|ある|、|ロンドンオリンピック|の|卓球女子団体|で|銀|メダル|獲得|に|貢献|し|た|選手|は|誰|でしょう|？|,25
1195,日本の漢字一文字の市で、光市や萩市があるのは山口県ですが、旭市や柏市があるのはどこの都道府県でしょう？,千葉県,|日本|の|漢字一文字|の|市|で|、|光|市|や|萩市|が|ある|の|は|山口県|です|が|、|旭市|や|柏市|が|ある|の|は|どこ|の|都道府県|でしょう|？|,31
1196,これまでにノーベル文学賞を受賞した日本の作家は、川端康成と誰でしょう？,大江健三郎(おおえ・けんざぶろう),|これ|まで|に|ノーベル|文学賞|を|受賞|し|た|日本|の|作家|は|、|川端康成|と|誰|でしょう|？|,19
1197,テニスの4大大会のうち、唯一クレーコートで行われるのはどれでしょう？,全仏オープン,|テニス|の|4|大|大会|の|うち|、|唯一|クレー|コート|で|行わ|れる|の|は|どれ|でしょう|？|,19
1198,一般に色の三属性といえば、明度、彩度と何でしょう？,色彩or色相,|一般|に|色|の|三属性|と|いえ|ば|、|明度|、|彩度|と|何|でしょう|？|,16
1199,イタリア・ロンバルディア州の州都で、ヨーロッパを代表する歌劇場・スカラ座がある都市はどこでしょう？,ミラノ(Milano),|イタリア|・|ロンバルディア|州|の|州都|で|、|ヨーロッパ|を|代表|する|歌劇|場|・|スカラ|座|が|ある|都市|は|どこ|でしょう|？|,24
1200,「多年にわたり社会につくしてきた老人を敬愛し、長寿を祝う日」と定められている、国民の祝日は何でしょう？,敬老の日,|「|多年|に|わたり|社会|に|つくし|て|き|た|老人|を|敬愛|し|、|長寿|を|祝う|日|」|と|定め|られ|て|いる|、|国民|の|祝日|は|何|でしょう|？|,33
1201,主なメンバーには西村雅彦や梶原善(かじはら・ぜん)などがいた、演出家の三谷幸喜が主宰をしていた劇団名は何でしょう？,東京サンシャインボーイズ,|主な|メンバー|に|は|西村雅彦|や|梶原善|など|が|い|た|、|演出|家|の|三谷幸喜|が|主宰|を|し|て|い|た|劇団名|は|何|でしょう|？|,28
1202,ムラサキ、オオバナ、ヤクシマなどの種類がある、3か月程度花を咲かせ続けることから漢字で「百日紅(ひゃくじつこう)」と書くミソハギ科の植物は何でしょう？,サルスベリ,|ムラサキ|、|オオ|バナ|、|ヤクシマ|など|の|種類|が|ある|、|3|か月|程度花|を|咲か|せ|続ける|こと|から|漢字|で|「百日紅」|と|書く|ミソハギ|科|の|植物|は|何|でしょう|？|,34
1203,平安時代、鎌倉時代、江戸時代のうち、最も長く続いた時代はどれでしょう？,平安時代,|平安時代|、|鎌倉時代|、|江戸時代|の|うち|、|最も|長く|続い|た|時代|は|どれ|でしょう|？|,17
1204,オリコン歴代シングル売上枚数ランキング1位を記録している童謡は何でしょう？,『およげ!たいやきくん』,|オリコン|歴代|シングル|売上枚数|ランキング|1|位|を|記録|し|て|いる|童謡|は|何|でしょう|？|,17
1205,兄から詩を作るように命じられた魏の曹植の故事に由来する、詩を作る才能が高いことを指す故事成語は何でしょう？,七歩(しちほ)の才,|兄|から|詩|を|作る|よう|に|命じ|られ|た|魏|の|曹植|の|故事|に|由来|する|、|詩|を|作る|才能|が|高い|こと|を|指す|故事成語|は|何|でしょう|？|,33
1206,公開鍵暗号のRSA暗号にも応用されている、ある整数をいくつかの素数の積の形にすることを何というでしょう？,素因数分解,|公開鍵暗号|の|RSA|暗号|に|も|応用|さ|れ|て|いる|、|ある|整数|を|いく|つ|か|の|素|数|の|積|の|形|に|する|こと|を|何|と|いう|でしょう|？|,34
1207,1505年に教皇ユリオ2世が招いて以来、ローマ法王の警護を担当するようになったのは、どこの国の兵士でしょう？,スイス,|1505|年|に|教皇|ユリオ|2|世|が|招い|て|以来|、|ローマ|法王|の|警護|を|担当|する|よう|に|なっ|た|の|は|、|どこ|の|国|の|兵士|でしょう|？|,33
1208,野口雨情作詞の童謡『七つの子』に歌われているのは、どんな生き物の子どもでしょう？,カラス,|野口雨情作詞|の|童謡|『七つの子』|に|歌わ|れ|て|いる|の|は|、|どんな|生き物|の|子ども|でしょう|？|,18
1209,源氏の武将・源頼朝が征夷大将軍になったのは西暦何年のことでしょう？,1192年,|源氏|の|武将|・|源頼朝|が|征夷大将軍|に|なっ|た|の|は|西暦何年|の|こと|でしょう|？|,17
1210,スキューバダイビングで、お互いの安全を確認するために組むペアを何というでしょう？,バディ(buddy),|スキューバ|ダイビング|で|、|お|互い|の|安全|を|確認|する|ため|に|組む|ペア|を|何|と|いう|でしょう|？|,21
1211,どこで死んでも世の中には骨を埋める場所ぐらいある、という意味の慣用句を「人間(じんかん)到る処何あり」というでしょう？,青山(せいざん),|どこ|で|死ん|で|も|世の中|に|は|骨|を|埋める|場所|ぐらい|ある|、|と|いう|意味|の|慣用句|を|「|人間|到る|処|何|あり|」|と|いう|でしょう|？|,32
1212,缶詰の缶などの素材として用いられる、鉄板にスズをメッキしたものを何というでしょう？,ブリキ,|缶詰|の|缶|など|の|素材|と|し|て|用い|られる|、|鉄板|に|スズ|を|メッキ|し|た|もの|を|何|と|いう|でしょう|？|,26
1213,鉛筆の本数を数える際に用いる、12を1とする単位は何でしょう？,ダース,|鉛筆|の|本数|を|数える|際|に|用いる|、|12|を|1|と|する|単位|は|何|でしょう|？|,19
1214,「絶対に穴の開かない金属VS(バーサス)どんな金属にも穴を開けられるドリル」など相反するもの同士の対決を行う、フジテレビ系列で放送中のバラエティ番組は何でしょう？,『ほこ×たて』,|「|絶対|に|穴|の|開か|ない|金属|VS|どんな|金属|に|も|穴|を|開け|られる|ドリル|」|など|相|反する|もの|同士|の|対決|を|行う|、|フジテレビ|系列|で|放送|中|の|バラエティ|番組|は|何|でしょう|？|,41
1215,日本で最も多い971の島を持つ都道府県といえばどこでしょう？,長崎県,|日本|で|最も|多い|971|の|島|を|持つ|都道府県|と|いえ|ば|どこ|でしょう|？|,16
1216,英語では「モーニングシックネス」という、吐き気などの妊娠中に起こる消化器官のトラブルを何というでしょう？,悪阻(つわり、おそ),|英語|で|は|「|モーニング|シックネス|」|と|いう|、|吐き気|など|の|妊娠|中|に|起こる|消化器官|の|トラブル|を|何|と|いう|でしょう|？|,26
1217,最後は清涼殿に現れたところを源頼政に射られて退治されたという、猿の顔、狸の胴、虎の手足、蛇の尻尾を持つ怪物は何でしょう？,鵺(ぬえ),|最後|は|清涼|殿|に|現れ|た|ところ|を|源頼政|に|射|られ|て|退治|さ|れ|た|と|いう|、|猿|の|顔|、|狸|の|胴|、|虎|の|手足|、|蛇|の|尻尾|を|持つ|怪物|は|何|でしょう|？|,43
1218,毎年2月にロサンゼルスのステイプルズ・センターで開催され、受賞者には蓄音機の形をしたトロフィーが贈られるアメリカの音楽賞は何でしょう？,グラミー賞,|毎年|2|月|に|ロサンゼルス|の|ステイプルズ|・|センター|で|開催|さ|れ|、|受賞|者|に|は|蓄音機|の|形|を|し|た|トロフィー|が|贈ら|れる|アメリカ|の|音楽賞|は|何|でしょう|？|,35
1219,日本語では「天象儀」と訳されることが多い、星の運動を再現し映写する装置のことを何というでしょう？,プラネタリウム,|日本語|で|は|「天象儀」|と|訳さ|れる|こと|が|多い|、|星|の|運動|を|再現|し|映写|する|装置|の|こと|を|何|と|いう|でしょう|？|,28
1220,直径は7.62cm、厚さは2.54cmである、アイスホッケーに使われるゴム製の円盤を何というでしょう？,パック,|直径|は|7|.|62|cm|、|厚|さ|は|2|.|54|cm|で|ある|、|アイス|ホッケー|に|使わ|れる|ゴム|製|の|円盤|を|何|と|いう|でしょう|？|,32
1221,英語版は2012年末で紙媒体での発行を終了し電子版に移行した、「TIME」と並ぶニュース雑誌は何でしょう？,「Newsweek」(ニューズウィーク),|英語版|は|2012|年|末|で|紙媒体|で|の|発行|を|終了|し|電子版|に|移行|し|た|、|「TIME」|と|並ぶ|ニュース|雑誌|は|何|でしょう|？|,28
1222,昨年コンビ結成30周年を迎えた、浜田雅功と松本人志の2人からなるお笑いコンビの名前は何でしょう？,ダウンタウン,|昨年|コンビ|結成|30|周年|を|迎え|た|、|浜田雅功|と|松本人志|の|2|人|から|なる|お|笑い|コンビ|の|名前|は|何|でしょう|？|,26
1223,1488年にアフリカ大陸の喜望峰に到達したことで知られる、ポルトガルの航海士は誰でしょう？,バルトロメウ・ディアス(Bartholomeu Dias),|1488|年|に|アフリカ|大陸|の|喜望峰|に|到達|し|た|こと|で|知ら|れる|、|ポルトガル|の|航海|士|は|誰|でしょう|？|,24
1224,鳥男(とりおとこ)を店のキャラクターにしている居酒屋チェーンで、名物料理「幻の手羽先」で知られるのはどこでしょう？,世界の山ちゃん,|鳥男|を|店|の|キャラクター|に|し|て|いる|居酒屋|チェーン|で|、|名物料理|「幻の手羽先」|で|知ら|れる|の|は|どこ|でしょう|？|,23
1225,手品において、観客の視線や注意を、注目されると都合の悪い部分から逸らせる技法のことを、英語で何というでしょう？,ミスディレクション(misdirection)orレッドヘリング(red herring),|手品|に|おい|て|、|観客|の|視線|や|注意|を|、|注目|さ|れる|と|都合|の|悪い|部分|から|逸らせる|技法|の|こと|を|、|英語|で|何|と|いう|でしょう|？|,34
1226,大気圧の実験を行ったトリチェリを弟子にもつ、地動説を主張したイタリアの物理学者は誰でしょう？,ガリレオ・ガリレイ,|大|気圧|の|実験|を|行っ|た|トリチェリ|を|弟子|に|もつ|、|地動説|を|主張|し|た|イタリア|の|物理|学|者|は|誰|でしょう|？|,27
1227,すぐれた人のいない場所でつまらない人が威張ることを、ある生き物を使って「鳥無き里の何」というでしょう？,蝙蝠(こうもり),|すぐれ|た|人|の|い|ない|場所|で|つまら|ない|人|が|威張る|こと|を|、|ある|生き物|を|使っ|て|「鳥無き里の何」|と|いう|でしょう|？|,26
1228,江戸時代末期に「幕末の三舟」と呼ばれたのは、勝海舟、山岡鉄舟と誰でしょう？,高橋泥舟(たかはし・でいしゅう),|江戸時代末期|に|「幕末の三舟」|と|呼ば|れ|た|の|は|、|勝海舟|、|山岡鉄舟|と|誰|でしょう|？|,17
1229,「戦争の放棄」について書かれているのは、日本国憲法の第何条でしょう？,第9条,|「戦争の放棄」|に|つい|て|書か|れ|て|いる|の|は|、|日本|国|憲法|の|第|何条|でしょう|？|,19
1230,ボクシングで、セコンドが試合をストップするためにリングに投げ入れるものは何でしょう？,タオル,|ボクシング|で|、|セコンド|が|試合|を|ストップ|する|ため|に|リング|に|投げ入れる|もの|は|何|でしょう|？|,19
1231,主人公の円堂守(えんどうまもる)がキャプテンを務める雷門中学の弱小サッカー部が、世界を目指すまでを描いた人気アニメ・ゲームシリーズは何でしょう？,『イナズマイレブン』,|主人|公|の|円堂守|が|キャプテン|を|務める|雷門中学|の|弱小|サッカー|部|が|、|世界|を|目指す|まで|を|描い|た|人気|アニメ|・|ゲーム|シリーズ|は|何|でしょう|？|,31
1232,福岡の民謡『炭坑節』で、月が出たと歌われている炭鉱はどこでしょう？,三池炭鉱,|福岡|の|民謡|『炭坑節』|で|、|月|が|出|た|と|歌わ|れ|て|いる|炭鉱|は|どこ|でしょう|？|,20
1233,栃木県が全国生産量の約98%を占める、薄く剥いた夕顔を乾かして作る食品は何でしょう？,干瓢,|栃木県|が|全国生産量|の|約|98|%|を|占める|、|薄く|剥い|た|夕顔|を|乾かし|て|作る|食品|は|何|でしょう|？|,23
1234,日本近海の海流の別名で、日本海流は「黒潮」といいますが、千島海流は同じく「潮」という字を使って何というでしょう？,親潮(おやしお),|日本近海|の|海流|の|別名|で|、|日本海流|は|「黒潮」|と|いい|ます|が|、|千島海流|は|同じく|「潮」|と|いう|字|を|使っ|て|何|と|いう|でしょう|？|,30
1235,著書『政治学』の中で「人間は生まれつきポリス的動物である」という言葉を残した、プラトンの弟子にあたる古代ギリシャの哲学者は誰でしょう？,アリストテレス(Aristotelēs),|著書|『政治学』|の|中|で|「|人間|は|生まれつき|ポリス|的|動物|で|ある|」|と|いう|言葉|を|残し|た|、|プラトン|の|弟子|に|あたる|古代|ギリシャ|の|哲学|者|は|誰|でしょう|？|,36
1236,地球からの呼び掛けに対し「これ、本番ですか?」と答えた逸話で知られる、1990年、ソユーズTM11で宇宙に飛び立ち、日本人初の宇宙飛行士となった人物は誰でしょう？,秋山豊寛(あきやま・とよひろ),|地球|から|の|呼び掛け|に|対し|「|これ|、|本番|です|か|?|」|と|答え|た|逸話|で|知ら|れる|、|1990|年|、|ソユーズ|TM|11|で|宇宙|に|飛び立ち|、|日本|人|初|の|宇宙飛行|士|と|なっ|た|人物|は|誰|でしょう|？|,47
1237,弓を片手に馬に乗る人は、ふつう、馬の手綱はどちらの手に握るでしょう？,右手,|弓|を|片手|に|馬|に|乗る|人|は|、|ふつう|、|馬|の|手綱|は|どちら|の|手|に|握る|でしょう|？|,23
1238,経営の苦しい会社が、借金の返済と新たな借金を繰り返しながら経営を続ける様子を、実在する乗り物を用いて何というでしょう？,自転車操業,|経営|の|苦しい|会社|が|、|借金|の|返済|と|新た|な|借金|を|繰り返し|ながら|経営|を|続ける|様子|を|、|実在|する|乗り物|を|用い|て|何|と|いう|でしょう|？|,33
1239,相棒である亀山薫(かめやま・かおる)、神部尊(かんべ・たける)、甲斐享(かい・とおる)と共に事件解決する、TVドラマ『相棒』の主人公は誰でしょう？,杉下右京,|相棒|で|ある|亀山薫|、|神部|尊|、|甲斐享|と|共|に|事件解決|する|、|TV|ドラマ|『相棒』|の|主人|公|は|誰|でしょう|？|,25
1240,カパアウやホノルルにある銅像でも知られる、1810年に初めてハワイ諸島を統一したハワイ王国の初代国王は誰でしょう？,カメハメハ1世(Kamehameha I),|カパアウ|や|ホノルル|に|ある|銅像|で|も|知ら|れる|、|1810|年|に|初めて|ハワイ|諸島|を|統一|し|た|ハワイ|王国|の|初代国王|は|誰|でしょう|？|,29
1241,日本銀行本店本館や東京駅の赤レンガの駅舎を設計した、日本の建築家は誰でしょう？,辰野金吾(たつの・きんご),|日本銀行本店本館|や|東京駅|の|赤|レンガ|の|駅舎|を|設計|し|た|、|日本|の|建築|家|は|誰|でしょう|？|,21
1242,ロッククライミングの練習場やスキー場のことを、「土地」という意味のドイツ語で何というでしょう？,ゲレンデ,|ロッククライミング|の|練習|場|や|スキー|場|の|こと|を|、|「土地」|と|いう|意味|の|ドイツ|語|で|何|と|いう|でしょう|？|,24
1243,コンパクト、ミラーレス一眼、一眼レフなどの種類がある、フィルムを使わないカメラの種類を何というでしょう？,デジタルカメラ,|コンパクト|、|ミラー|レス|一|眼|、|一|眼|レフ|など|の|種類|が|ある|、|フィルム|を|使わ|ない|カメラ|の|種類|を|何|と|いう|でしょう|？|,29
1244,登山家の今井通子(みちこ)が山頂で結婚式を挙げている標高4208mの山で、マッターホルン、アイガーと並びアルプス三大北壁とされるのはどこでしょう？,グランド・ジョラス(Grandes jorasses),|登山|家|の|今井通子|が|山頂|で|結婚式|を|挙げ|て|いる|標高|4208|m|の|山|で|、|マッターホルン|、|アイガー|と|並び|アルプス|三|大|北壁|と|さ|れる|の|は|どこ|でしょう|？|,36
1245,ケストナーの小説『ふたりのロッテ』で、ロッテと出会う彼女の双子の姉妹の名前は何でしょう？,ルイーゼ,|ケストナー|の|小説|『|ふたり|の|ロッテ|』|で|、|ロッテ|と|出会う|彼女|の|双子|の|姉妹|の|名前|は|何|でしょう|？|,24
1246,お酒を飲む時に用いる「おちょこ」を漢字で書いた時に出てくる生き物は何でしょう？,猪(いのしし),|お|酒|を|飲む|時|に|用いる|「おちょこ」|を|漢字|で|書い|た|時|に|出|て|くる|生き物|は|何|でしょう|？|,23
1247,6世紀頃のインドで、「空虚」を表す「スーニャ」という言葉から転じて発見されたといわれている、プラスでもマイナスもない数字といえば何でしょう？,0(ゼロ),|6|世紀頃|の|インド|で|、|「空虚」|を|表す|「スーニャ」|と|いう|言葉|から|転じ|て|発見|さ|れ|た|と|いわ|れ|て|いる|、|プラス|で|も|マイナス|も|ない|数字|と|いえ|ば|何|でしょう|？|,39
1248,野球のグラウンドをならすT字状の整備用具を、ある昆虫に例えて何というでしょう？,トンボ,|野球|の|グラウンド|を|ならす|T|字|状|の|整備|用|具|を|、|ある|昆虫|に|例え|て|何|と|いう|でしょう|？|,24
1249,楽譜に表記される記号で、シャープを「嬰記号」、フラットを「変記号」といいますが、ナチュラルは「何記号」というでしょう？,本位記号,|楽譜|に|表記|さ|れる|記号|で|、|シャープ|を|「嬰記号」|、|フラット|を|「変記号」|と|いい|ます|が|、|ナチュラル|は|「何記号」|と|いう|でしょう|？|,27
1250,後の江戸幕府の成立へのきっかけとなった、1600年、西の石田三成と東の徳川家康のそれぞれの連合軍が衝突した戦いを何というでしょう？,関ヶ原の戦い,|後|の|江戸幕府|の|成立|へ|の|きっかけ|と|なっ|た|、|1600|年|、|西|の|石田三成|と|東|の|徳川家康|の|それぞれ|の|連合軍|が|衝突|し|た|戦い|を|何|と|いう|でしょう|？|,37
1251,佐野市があるのは栃木県ですが、泉佐野市がある都道府県はどこでしょう？,大阪府,|佐野市|が|ある|の|は|栃木県|です|が|、|泉佐野市|が|ある|都道府県|は|どこ|でしょう|？|,17
1252,気象庁のアメダスで「四要素観測所」が観測している4つの要素とは「降水量」「気温」「風向風速」ともう一つは何でしょう？,日照時間,|気象|庁|の|アメダス|で|「四要素観測所」|が|観測|し|て|いる|4|つ|の|要素|と|は|「降水量」|「気温」|「風向風速」|と|もう|一|つ|は|何|でしょう|？|,28
1253,パステルカラーよりも淡い色のことを、ある冷たい食べ物の名をとって「何カラー」というでしょう？,シャーベットカラー,|パステル|カラー|より|も|淡い|色|の|こと|を|、|ある|冷たい|食べ物|の|名|を|とっ|て|「何カラー」|と|いう|でしょう|？|,23
1254,小説『Kの悲劇』でデビューした、代表作に『朝比奈耕作』シリーズなどがある推理作家は誰でしょう？,吉村達也(よしむら・たつや),|小説|『Kの悲劇』|で|デビュー|し|た|、|代表|作|に|『朝比奈耕作』|シリーズ|など|が|ある|推理作家|は|誰|でしょう|？|,20
1255,アイドルグループ「KinKi Kids」のメンバーに共通する苗字は何でしょう？,堂本(どうもと),|アイドル|グループ|「|KinKiKids|」|の|メンバー|に|共通|する|苗字|は|何|でしょう|？|,15
