data_id,question,answer,tokens,token_count
1851,昨年(2013年)9月29日に亡くなった、代表作にドラマ化された『白い巨塔』『華麗なる一族』などがある女性小説家は誰でしょう？,山崎豊子(やまさき・とよこ),|昨年(2013年)|9|月|29|日|に|亡くなっ|た|、|代表|作|に|ドラマ|化|さ|れ|た|『白い巨塔』|『華麗なる一族』|など|が|ある|女性小説|家|は|誰|でしょう|？|,28
1852,ベートーヴェンの交響曲第3番『英雄』は、もともと誰を讃えて作曲されたでしょう？,ナポレオン,|ベートーヴェン|の|交響曲|第|3|番|『英雄』|は|、|もともと|誰|を|讃え|て|作曲|さ|れ|た|でしょう|？|,20
1853,サーフィンにおいて、サーファーが乗る楕円形の板のことを何というでしょう？,サーフボード,|サーフィン|に|おい|て|、|サーファー|が|乗る|楕円|形|の|板|の|こと|を|何|と|いう|でしょう|？|,20
1854,日本の都道府県で、豊田スタジアムがあるのは愛知県ですが、日産スタジアムがあるのは何県でしょう？,神奈川県,|日本|の|都道府県|で|、|豊田|スタジアム|が|ある|の|は|愛知県|です|が|、|日産|スタジアム|が|ある|の|は|何県|でしょう|？|,24
1855,漢字では「家の鴨(いえのかも)」と書く、マガモを飼いならして家畜にした鳥は何でしょう？,アヒル,|漢字|で|は|「家の鴨」|と|書く|、|マガモ|を|飼いならし|て|家畜|に|し|た|鳥|は|何|でしょう|？|,20
1856,日光東照宮の国宝『眠り猫』の作者とされる、江戸時代の彫刻家は誰でしょう？,左甚五郎(ひだり・じんごろう),|日光東照|宮|の|国宝|『眠り猫』|の|作者|と|さ|れる|、|江戸時代|の|彫刻|家|は|誰|でしょう|？|,19
1857,英語圏のメールなどで使用される略語「BTW」とは、何という言葉を略したものでしょう？,By The Way,|英語|圏|の|メール|など|で|使用|さ|れる|略語|「BTW」|と|は|、|何|と|いう|言葉|を|略し|た|もの|でしょう|？|,24
1858,スタジオジブリの映画『風立ちぬ』で主人公のモデルとなった、ゼロ戦の設計主任を務めたことで知られる航空技術者は誰でしょう？,堀越二郎(ほりこし・じろう),|スタジオジブリ|の|映画|『風立ちぬ』|で|主人|公|の|モデル|と|なっ|た|、|ゼロ|戦|の|設計主任|を|務め|た|こと|で|知ら|れる|航空技術|者|は|誰|でしょう|？|,30
1859,世界中の中華街に見られる、中国三国時代の武将・関羽を祀った霊廟のことを何というでしょう？,関帝廟(かんていびょう),|世界|中|の|中華|街|に|見|られる|、|中国三|国|時代|の|武将|・|関羽|を|祀っ|た|霊廟|の|こと|を|何|と|いう|でしょう|？|,28
1860,矢橋帰帆島(やばせきはんとう)、沖島(おきのしま)、竹生島(ちくぶじま)といえば、何という湖の中にある島でしょう？,琵琶湖,|矢橋帰帆|島|、|沖島|、|竹生|島|と|いえ|ば|、|何|と|いう|湖|の|中|に|ある|島|でしょう|？|,22
1861,ドラマの中で食べる料理や破る手紙など、一回の演技にしか使えない小道具をまとめて何というでしょう？,消え物,|ドラマ|の|中|で|食べる|料理|や|破る|手紙|など|、|一回|の|演技|に|しか|使え|ない|小|道具|を|まとめ|て|何|と|いう|でしょう|？|,28
1862,1983年から陸上の世界選手権で6連覇を達成し、「鳥人(ちょうじん)」と呼ばれた、ウクライナの棒高跳び選手は誰でしょう？,セルゲイ・ブブカ,|1983|年|から|陸上|の|世界選手|権|で|6|連覇|を|達成|し|、|「鳥人」|と|呼ば|れ|た|、|ウクライナ|の|棒|高跳び|選手|は|誰|でしょう|？|,29
1863,603年に「冠位十二階」が定められたときの日本の天皇は誰だったでしょう？,推古天皇(すいこ-),|603|年|に|「冠位十二階」|が|定め|られ|た|とき|の|日本|の|天皇|は|誰|だっ|た|でしょう|？|,19
1864,屋根の軒先(のきさき)に取り付けられ、雨水を集めて地上へと流す装置を何というでしょう？,樋(とい),|屋根|の|軒先|に|取り付け|られ|、|雨水|を|集め|て|地上|へ|と|流す|装置|を|何|と|いう|でしょう|？|,22
1865,少女漫画雑誌の出版社で、「りぼん」は集英社、「なかよし」は講談社ですが、「ちゃお」はどこでしょう？,小学館,|少女漫画雑誌|の|出版社|で|、|「りぼん」|は|集英社|、|「なかよし」|は|講談社|です|が|、|「ちゃお」|は|どこ|でしょう|？|,20
1866,現在発行されている52円切手の図柄になっている、気象庁の開花予想にも用いられている桜の品種は何でしょう？,ソメイヨシノ,|現在発行|さ|れ|て|いる|52|円切手|の|図柄|に|なっ|て|いる|、|気象|庁|の|開花予想|に|も|用い|られ|て|いる|桜|の|品種|は|何|でしょう|？|,31
1867,吉野ヶ里遺跡のものが有名な、弥生時代につくられた周りに濠(ほり)を巡らせた集落のことを何というでしょう？,環濠集落(かんごうしゅうらく),|吉野ヶ里|遺跡|の|もの|が|有名|な|、|弥生時代|に|つくら|れ|た|周り|に|濠|を|巡ら|せ|た|集落|の|こと|を|何|と|いう|でしょう|？|,29
1868,遺伝子が異なる細胞が共存している生物個体のことを、ギリシャ神話の怪物にちなんで何というでしょう？,キメラ,|遺伝|子|が|異なる|細胞|が|共存|し|て|いる|生物個体|の|こと|を|、|ギリシャ|神話|の|怪物|に|ちなん|で|何|と|いう|でしょう|？|,27
1869,妊娠してから数えで10カ月目のことを、出産予定の月という意味の言葉で一般に何というでしょう？,臨月,|妊娠|し|て|から|数え|で|10|カ月|目|の|こと|を|、|出産予定|の|月|と|いう|意味|の|言葉|で|一般|に|何|と|いう|でしょう|？|,29
1870,競り上げ式の「イングリッシュ」、競り下げ式の「ダッチ」などの種類がある、希望者に入札金額を競わせる売買方式を何というでしょう？,オークション,|競り上げ|式|の|「|イングリッシュ|」|、|競り|下げ|式|の|「ダッチ」|など|の|種類|が|ある|、|希望|者|に|入札金額|を|競わ|せる|売買方式|を|何|と|いう|でしょう|？|,32
1871,暦の「3月」や天体の「火星」の英語名の由来となっている、ローマ神話の戦いの神は誰でしょう？,マルス,|暦|の|「3月」|や|天体|の|「火星」|の|英語名|の|由来|と|なっ|て|いる|、|ローマ|神話|の|戦い|の|神|は|誰|でしょう|？|,26
1872,東京23区のうち、東京駅があるのは何区でしょう？,千代田区,|東京|23|区|の|うち|、|東京駅|が|ある|の|は|何区|でしょう|？|,14
1873,日本人投手の田澤純一・上原浩治らの活躍により、昨年(2013年)のワールドシリーズを制したメジャーリーグのチームはどこでしょう？,ボストン・レッドソックス,|日本|人|投手|の|田澤純一|・|上原浩治|ら|の|活躍|に|より|、|昨年(2013年)|の|ワールド|シリーズ|を|制し|た|メジャー|リーグ|の|チーム|は|どこ|でしょう|？|,28
1874,長崎市の出島橋が現存する日本最古のものである、桁の部分に三角形の集まりを用いた構造をもつ橋のことを何というでしょう？,トラス橋,|長崎市|の|出島橋|が|現存|する|日本最古|の|もの|で|ある|、|桁|の|部分|に|三角|形|の|集まり|を|用い|た|構造|を|もつ|橋|の|こと|を|何|と|いう|でしょう|？|,35
1875,オージーラムやオージービーフといえば、共通して原産国となっている国はどこでしょう？,オーストラリア,|オージー|ラム|や|オージー|ビーフ|と|いえ|ば|、|共通|し|て|原産|国|と|なっ|て|いる|国|は|どこ|でしょう|？|,23
1876,「ライカの神様」や「スナップの達人」と呼ばれた、朝日新聞社主催の写真賞に名を残す日本のカメラマンは誰でしょう？,木村伊兵衛(きむら・いへい),|「ライカの神様」|や|「|スナップ|の|達人|」|と|呼ば|れ|た|、|朝日新聞社主催|の|写真賞|に|名|を|残す|日本|の|カメラマン|は|誰|でしょう|？|,26
1877,ドイツの法学者・ラートブルフによって提唱された、宗教的・政治的な思想に基づいてなされる犯罪のことを何犯というでしょう？,確信犯,|ドイツ|の|法学|者|・|ラートブルフ|に|よっ|て|提唱|さ|れ|た|、|宗教|的|・|政治|的|な|思想|に|基づい|て|なさ|れる|犯罪|の|こと|を|何|犯|と|いう|でしょう|？|,36
1878,楽器を用いず歌声だけで旋律を奏でる合唱曲のことを、「礼拝堂風に」という意味のイタリア語で何というでしょう？,ア・カペラ,|楽器|を|用い|ず|歌声|だけ|で|旋律|を|奏でる|合唱曲|の|こと|を|、|「礼拝堂風に」|と|いう|意味|の|イタリア|語|で|何|と|いう|でしょう|？|,28
1879,「ツリパン」とも呼ばれる、上下一体型のレスリングのユニフォームを、英語で何というでしょう？,シングレット,|「ツリパン」|と|も|呼ば|れる|、|上下一体|型|の|レスリング|の|ユニフォーム|を|、|英語|で|何|と|いう|でしょう|？|,21
1880,産地である兵庫県の地名にちなんでこう呼ばれる、花崗岩の建築材料としての別名は何でしょう？,御影石(みかげいし),|産地|で|ある|兵庫県|の|地名|に|ちなん|で|こう|呼ば|れる|、|花崗|岩|の|建築材料|と|し|て|の|別名|は|何|でしょう|？|,26
1881,日本テレビ系列の人気番組『笑点』の大喜利コーナーでは、座布団を何枚集めると賞品がもらえることになっているでしょう？,10枚,|日本|テレビ|系列|の|人気番組|『笑点』|の|大喜利|コーナー|で|は|、|座布団|を|何|枚|集める|と|賞品|が|もらえる|こと|に|なっ|て|いる|でしょう|？|,28
1882,元素の周期表で、水素の1段下にあるのはリチウムですが、リチウムの1段下にあるのは何でしょう？,ナトリウム,|元素|の|周期表|で|、|水素|の|1|段|下|に|ある|の|は|リチウム|です|が|、|リチウム|の|1|段|下|に|ある|の|は|何|でしょう|？|,30
1883,ずばり、日本銀行券の製造を担当する独立行政法人は何でしょう？,国立印刷局,|ずばり|、|日本銀行券|の|製造|を|担当|する|独立行政法人|は|何|でしょう|？|,13
1884,中国の三国時代の初代皇帝で、蜀は劉備、呉は孫権ですが、魏は誰でしょう？,曹丕(そうひ),|中国|の|三|国|時代|の|初代皇帝|で|、|蜀|は|劉備|、|呉|は|孫権|です|が|、|魏|は|誰|でしょう|？|,24
1885,救世観音像(くぜかんのんぞう)を本尊とする、奈良の法隆寺にある八角形のお堂のことを何というでしょう？,夢殿(ゆめどの),|救世観音像|を|本尊|と|する|、|奈良|の|法隆|寺|に|ある|八角|形|の|お|堂|の|こと|を|何|と|いう|でしょう|？|,25
1886,「わんわん」や「がらがら」などといった擬声語や擬態語のことを、フランス語で何というでしょう？,オノマトペ,|「わんわん」|や|「がらがら」|など|と|いっ|た|擬声語|や|擬態語|の|こと|を|、|フランス|語|で|何|と|いう|でしょう|？|,22
1887,二十四節気のうち、漢字の雨という字が使われているのは雨水と何でしょう？,穀雨(こくう),|二十四節気|の|うち|、|漢字|の|雨|と|いう|字|が|使わ|れ|て|いる|の|は|雨水|と|何|でしょう|？|,22
1888,その名はイギリスのバージニア植民地初代総督にちなんでいる、州都をドーバーに置くアメリカの州は何でしょう？,デラウェア州,|その|名|は|イギリス|の|バージニア|植民地初代総督|に|ちなん|で|いる|、|州都|を|ドーバー|に|置く|アメリカ|の|州|は|何|でしょう|？|,24
1889,昨年(2013年)9月に人工物として初めて太陽圏を脱出したことが発表された、1977年にNASAが打ち上げた無人探査機は何でしょう？,ボイジャー1号,|昨年(2013年)|9|月|に|人工|物|と|し|て|初めて|太陽|圏|を|脱出|し|た|こと|が|発表|さ|れ|た|、|1977|年|に|NASA|が|打ち上げ|た|無人探査機|は|何|でしょう|？|,35
1890,核兵器を持たない国が保有国と同盟を結ぶことで見込まれる抑止力のことを、頭上を守る道具にたとえて何というでしょう？,核の傘,|核兵器|を|持た|ない|国|が|保有|国|と|同盟|を|結ぶ|こと|で|見込ま|れる|抑止|力|の|こと|を|、|頭上|を|守る|道具|に|たとえ|て|何|と|いう|でしょう|？|,34
1891,東京でストリッパーをしている「おきん」が里帰りして起こす騒動を描いた、日本初の総天然色映画は何でしょう？,『カルメン故郷に帰る』,|東京|で|ストリッパー|を|し|て|いる|「おきん」|が|里帰り|し|て|起こす|騒動|を|描い|た|、|日本初|の|総|天然|色|映画|は|何|でしょう|？|,28
1892,お菓子メーカー「カルビー」の名前の由来となった2つの栄養素とは、カルシウムと何でしょう？,ビタミンB1,|お|菓子|メーカー|「カルビー」|の|名前|の|由来|と|なっ|た|2|つ|の|栄養|素|と|は|、|カルシウム|と|何|でしょう|？|,24
1893,レオ・レオーニの童話『スイミー』で、スイミーの身体の色は何色でしょう？,黒,|レオ|・|レオーニ|の|童話|『スイミー』|で|、|スイミー|の|身体|の|色|は|何色|でしょう|？|,17
1894,昨年(2013年)発足した日本の国家安全保障会議の4大臣会合に出席するのは、内閣総理大臣、外務大臣、防衛大臣と誰でしょう？,内閣官房長官,|昨年(2013年)|発足|し|た|日本|の|国家安全保障会議|の|4|大臣会合|に|出席|する|の|は|、|内閣総理大臣|、|外務大臣|、|防衛大臣|と|誰|でしょう|？|,25
1895,神社の境内にある、お守りの購入や祈祷の受付を行うための建物を何というでしょう？,社務所(しゃむしょ),|神社|の|境内|に|ある|、|お|守り|の|購入|や|祈祷|の|受付|を|行う|ため|の|建物|を|何|と|いう|でしょう|？|,25
1896,幕末・明治期に活躍した歌人・中島歌子の生涯を描いた、朝井まかての第150回直木賞受賞作は何でしょう？,『恋歌』(れんか),|幕末|・|明治期|に|活躍|し|た|歌人|・|中島歌子|の|生涯|を|描い|た|、|朝井|ま|か|て|の|第|150|回直木賞受賞|作|は|何|でしょう|？|,29
1897,映画の監督をすることを、監督が手に持つあるものを使って「何をとる」というでしょう？,メガホン,|映画|の|監督|を|する|こと|を|、|監督|が|手|に|持つ|ある|もの|を|使っ|て|「何をとる」|と|いう|でしょう|？|,23
1898,昨年(2013年)には女性初の奨励会三段昇段も果たしている、「出雲のイナズマ」の二つ名で知られる女流棋士は誰でしょう？,里見香奈(さとみ・かな),|昨年(2013年)|に|は|女性初|の|奨励会三段昇段|も|果たし|て|いる|、|「|出雲|の|イナズマ|」|の|二|つ|名|で|知ら|れる|女流棋士|は|誰|でしょう|？|,28
1899,戦後、日本のTVAと呼ばれる大規模な開発が行われた、岩手県から宮城県にかけて流れる東北地方最大の河川は何でしょう？,北上川,|戦後|、|日本|の|TVA|と|呼ば|れる|大|規模|な|開発|が|行わ|れ|た|、|岩手県|から|宮城県|に|かけ|て|流れる|東北地方最大|の|河川|は|何|でしょう|？|,31
1900,本名を高森朝樹(たかもり・あさき)という、往年のスポコン漫画『あしたのジョー』や『巨人の星』の原作者は誰でしょう？,梶原一騎(かじわら・いっき),|本名|を|高森朝樹|と|いう|、|往年|の|スポコン|漫画|『|あした|の|ジョー|』|や|『巨人の星』|の|原作|者|は|誰|でしょう|？|,24
1901,劇中歌『狩人の合唱』が有名な、結婚を懸けて射撃大会に挑むマックスを主人公とするウェーバーのオペラは何でしょう？,『魔弾の射手』(まだんのしゃしゅ),|劇中|歌|『狩人の合唱』|が|有名|な|、|結婚|を|懸け|て|射撃大会|に|挑む|マックス|を|主人|公|と|する|ウェーバー|の|オペラ|は|何|でしょう|？|,27
1902,旧約聖書に登場する「ヘテ人(びと)」にちなんで命名された、世界で初めて鉄器文化を築いたとされる民族は何でしょう？,ヒッタイト,|旧約聖書|に|登場|する|「ヘテ人」|に|ちなん|で|命名|さ|れ|た|、|世界|で|初めて|鉄器文化|を|築い|た|と|さ|れる|民族|は|何|でしょう|？|,28
1903,ベンチの反対側に設置されている、アイスホッケーで、反則を犯した選手を一定時間収容する場所を何というでしょう？,ペナルティーボックス,|ベンチ|の|反対側|に|設置|さ|れ|て|いる|、|アイス|ホッケー|で|、|反則|を|犯し|た|選手|を|一定時間収容|する|場所|を|何|と|いう|でしょう|？|,29
1904,ジェイムズ・ジョイスの小説『ユリシーズ』の舞台にもなっている、アイルランドの首都はどこでしょう？,ダブリン,|ジェイムズ|・|ジョイス|の|小説|『ユリシーズ』|の|舞台|に|も|なっ|て|いる|、|アイルランド|の|首都|は|どこ|でしょう|？|,21
1905,日本語では「糖原質(とうげんしつ)」と訳される、肝臓や筋肉組織などにエネルギー源として蓄積されている多糖類は何でしょう？,グリコーゲン,|日本語|で|は|「糖原質」|と|訳さ|れる|、|肝臓|や|筋肉組織|など|に|エネルギー|源|と|し|て|蓄積|さ|れ|て|いる|多糖|類|は|何|でしょう|？|,29
1906,幼い頃からの友達のことを、ある遊び道具を用いて「何の友」というでしょう？,竹馬の友(ちくばのとも),|幼い|頃|から|の|友達|の|こと|を|、|ある|遊び|道具|を|用い|て|「何の友」|と|いう|でしょう|？|,20
1907,1692年に刊行された井原西鶴の浮世草子で、「大晦日は一日千金(おおつごもりはいちじつせんきん)」という副題が付けられているのは何でしょう？,『世間胸算用』(せけんむねさんよう),|1692|年|に|刊行|さ|れ|た|井原西鶴|の|浮世草子|で|、|「|大晦日|は|一|日|千金|」|と|いう|副題|が|付け|られ|て|いる|の|は|何|でしょう|？|,32
1908,茶に関する日本最古の書『喫茶養生記』も著している、臨済宗の開祖は誰でしょう？,栄西,|茶|に|関する|日本最古|の|書|『喫茶養生記』|も|著し|て|いる|、|臨済|宗|の|開祖|は|誰|でしょう|？|,20
1909,バイクレースの種目「モトクロス」とは、モーターサイクルと何という英語を組み合わせた言葉でしょう？,クロスカントリー,|バイク|レース|の|種目|「モトクロス」|と|は|、|モーターサイクル|と|何|と|いう|英語|を|組み合わせ|た|言葉|でしょう|？|,20
1910,和名を「マンネンロウ」といい、ラテン語で「海の露(つゆ)」を意味する言葉から名付けられたシソ科のハーブは何でしょう？,ローズマリー,|和名|を|「マンネンロウ」|と|いい|、|ラテン|語|で|「海の露」|を|意味|する|言葉|から|名付け|られ|た|シソ|科|の|ハーブ|は|何|でしょう|？|,26
1911,日本の国会では議員総数の3分の1以上にあたる、議会で議事を進めるために必要な最小限の出席数のことを何というでしょう？,定足数,|日本|の|国会|で|は|議員総数|の|3|分|の|1|以上|に|あたる|、|議会|で|議事|を|進める|ため|に|必要|な|最小|限|の|出席数|の|こと|を|何|と|いう|でしょう|？|,36
1912,ンゴロンゴロ保全地域、セレンゲティ国立公園、キリマンジャロ国立公園といった世界遺産がある国はどこでしょう？,タンザニア,|ンゴロンゴロ|保全地域|、|セレンゲティ|国立公園|、|キリマンジャロ|国立公園|と|いっ|た|世界遺産|が|ある|国|は|どこ|でしょう|？|,19
1913,数学で、多角形の外角の和は常に何度になるでしょう？,360度,|数学|で|、|多角|形|の|外角|の|和|は|常|に|何度|に|なる|でしょう|？|,17
1914,日本のツアーでは尾崎将司が記録している、ゴルフで自分の年齢より少ないスコアでホールアウトすることを何というでしょう？,エージシュート,|日本|の|ツアー|で|は|尾崎将司|が|記録|し|て|いる|、|ゴルフ|で|自分|の|年齢|より|少ない|スコア|で|ホール|アウト|する|こと|を|何|と|いう|でしょう|？|,31
1915,和食の作法で、汁物は食べる人から見て左右どちらに置くことになっているでしょう？,右,|和食|の|作法|で|、|汁物|は|食べる|人|から|見|て|左右|どちら|に|置く|こと|に|なっ|て|いる|でしょう|？|,23
1916,頼る相手を選ぶならば、力のあるものが良いということを、「寄らば何の陰」というでしょう？,大樹(たいじゅ),|頼る|相手|を|選ぶ|なら|ば|、|力|の|ある|もの|が|良い|と|いう|こと|を|、|「寄らば何の陰」|と|いう|でしょう|？|,23
1917,エッカーマンとの対話集でも有名な、小説『若きウェルテルの悩み』や詩劇『ファウスト』などの作品で知られるドイツの作家は誰でしょう？,ヨハン・ヴォルフガング・フォン・ゲーテ,|エッ|カーマン|と|の|対話|集|で|も|有名|な|、|小説|『|若き|ウェルテル|の|悩み|』|や|詩劇|『ファウスト』|など|の|作品|で|知ら|れる|ドイツ|の|作家|は|誰|でしょう|？|,34
1918,昨年(2013年)7月に、シングル『友達より大事な人』で歌手デビューした、人気の若手女優は誰でしょう？,剛力彩芽(ごうりき・あやめ),|昨年(2013年)|7|月|に|、|シングル|『|友達|より|大事|な|人|』|で|歌手|デビュー|し|た|、|人気|の|若手女優|は|誰|でしょう|？|,26
1919,1595年に豊臣秀吉が創建した天台宗の寺院で、大坂の陣のきっかけとなった釣り鐘で有名なのはどこでしょう？,方広寺,|1595|年|に|豊臣秀吉|が|創建|し|た|天台|宗|の|寺院|で|、|大坂|の|陣|の|きっかけ|と|なっ|た|釣り鐘|で|有名|な|の|は|どこ|でしょう|？|,31
1920,日本にある美術大学の中で、唯一の国立大学は何でしょう？,東京芸術大学,|日本|に|ある|美術大学|の|中|で|、|唯一|の|国立大学|は|何|でしょう|？|,15
1921,女優のジュリエッタ・マシーナを妻に持った、代表作に『道』『甘い生活』があるイタリアの映画監督は誰でしょう？,フェデリコ・フェリーニ,|女優|の|ジュリエッタ|・|マシーナ|を|妻|に|持っ|た|、|代表|作|に|『道』|『甘い生活』|が|ある|イタリア|の|映画監督|は|誰|でしょう|？|,25
1922,「女子20㎞」「男子20㎞」「男子50km」の3種目がオリンピックで行われている、陸上競技の種目は何でしょう？,競歩,|「女子20㎞」|「男子20㎞」|「男子50km」|の|3|種目|が|オリンピック|で|行わ|れ|て|いる|、|陸上競技|の|種目|は|何|でしょう|？|,21
1923,動物行動学を創始した20世紀オーストリアの人物で、特に「刷り込み」の研究で有名なのは誰でしょう？,コンラート・ローレンツ,|動物行動|学|を|創始|し|た|20|世紀|オーストリア|の|人物|で|、|特に|「刷り込み」|の|研究|で|有名|な|の|は|誰|でしょう|？|,25
1924,イタリア語で「停止」という意味がある、音符や休符の長さを十分に延長させる音楽記号は何でしょう？,フェルマータ,|イタリア|語|で|「停止」|と|いう|意味|が|ある|、|音符|や|休符|の|長|さ|を|十分|に|延長|さ|せる|音楽記号|は|何|でしょう|？|,27
1925,グラウビュンデン州などで話されている、フランス語、イタリア語、ドイツ語とともにスイスの公用語となっている言語は何でしょう？,ロマンシュ語,|グラウビュンデン|州|など|で|話さ|れ|て|いる|、|フランス|語|、|イタリア|語|、|ドイツ|語|と|とも|に|スイス|の|公用語|と|なっ|て|いる|言語|は|何|でしょう|？|,32
1926,「自己の危難を顧みず人命の救助に尽力した者」に与えられる、日本の褒章は何でしょう？,紅綬褒章(こうじゅほうしょう),|「|自己|の|危難|を|顧み|ず|人命|の|救助|に|尽力|し|た|者|」|に|与え|られる|、|日本|の|褒章|は|何|でしょう|？|,27
